{
    "Hero": "Nefertem of the Dawn",
    "Ship": "Invisible Night",
    "Type": "Heavy Destroyer",
    "Points": 81,
    "Tonnage": "L",
    "BaseSize": 30,
    "Profile": {
        "Thrust": 12,
        "Scan": 12,
        "Sig": 6,
        "Hull": 7,
        "ES": "5+",
        "KS": "4+",
        "BS": "-",
        "G": "1",
        "Special": [
            "Cloak-2",
            "Hero",
            "Shield-5+",
            "Stealth",
            "Unique"
        ]
    },
    "Weapons": [
        {
            "Name": "Microwave Crescent",
            "Arc": "F",
            "Att": 4,
            "Lock": "3+",
            "DMG": 1,
            "Type": "C",
            "Special": [
                "Crippling-2xFire",
                "Sustained Fire"
            ]
        }
    ],
    "Load": [],
    "KnownShips": [
        "Invisible Night"
    ],
    "Flavour": "Stealth technology and camouflage in all its forms are abhorrent and dishonourable for most Shaltari, but Nefertem chose long ago to reject this notion. Her stance is that subterfuge and surprise attack are time-honoured, central tenets of battle and has chosen to master them. To that end, she commissioned a unique vessel.\nInvisible Light demonstrates that, of course, the Shaltari are perfectly capable of matching or exceeding the Scourge in stealth technology if they so wish. Of heavy destroyer tonnage, this vessel's innocuous-looking additional frontal superstructure arms conceal this cloaking system as well as supporting the additional mass of its only weapons system. The thus-far unique Microwave Crescent is a long range, low-observable variant of typical microwave technology that can reach into the heart of any target, cooking its crew and delicate systems from the inside. Often, the victim has no idea where the burst came from and has little chance of returning fire."
}